{
  "id": "is-this-it",
  "title": "Is This It",
  "artist": "The Strokes",
  "year": 2001,
  "spotify": "2yNaksHgeMQM9Quse463b5",
  "cover": "https://i.scdn.co/image/ab67616d0000b273a388a3f20d1bf2123249cc79",
  "kingdom": "rock",
  "logseq": {
    "page": "Is This It"
  },
  "added": "2026-10-03",
  "first": "2024-01-16",
  "pack": null,
  "person": {
    "brief": "",
    "base": "rock",
    "traits": []
  }
}
