{
  "id": "inventio",
  "title": "Inventio",
  "artist": "Murex",
  "year": 2026,
  "spotify": "0ZicqrgX0XyaFYe9xJbO4Z",
  "cover": "https://i.scdn.co/image/ab67616d0000b2739ccea9e46734fee3119e57a6",
  "kingdom": "indie",
  "logseq": {
    "page": "Inventio"
  },
  "added": "2026-10-03",
  "first": "2026-09-27",
  "pack": null,
  "person": {
    "brief": "",
    "base": "indie",
    "traits": []
  }
}
