{
  "id": "loveless",
  "title": "loveless",
  "artist": "my bloody valentine",
  "year": 1991,
  "spotify": "3USQKOw0se5pBNEndu82Rb",
  "cover": "https://i.scdn.co/image/ab67616d0000b273db8e38addb58131f77b48377",
  "kingdom": "rock",
  "logseq": {
    "page": "loveless"
  },
  "added": "2026-10-02",
  "first": "2023-11-14",
  "pack": null
}
