{
  "id": "carrie-and-lowell",
  "title": "Carrie & Lowell",
  "artist": "Sufjan Stevens",
  "year": 2015,
  "spotify": "64xtjfsPHNHch0CZ7fPTjS",
  "cover": "https://i.scdn.co/image/ab67616d0000b273820e2ac14772ae3162c6d479",
  "kingdom": "indie",
  "logseq": {
    "page": "Carrie & Lowell"
  },
  "added": "2026-09-28",
  "first": null,
  "pack": "2026-W40",
  "person": {
    "brief": "",
    "base": "indie",
    "traits": []
  }
}
