{
  "id": "kid-a",
  "title": "Kid A",
  "artist": "Radiohead",
  "year": 2000,
  "spotify": "6GjwtEZcfenmOf6l18N7T7",
  "cover": "https://i.scdn.co/image/ab67616d0000b2736c7112082b63beefffe40151",
  "kingdom": "rock",
  "logseq": {
    "page": "Kid A"
  },
  "added": "2026-10-03",
  "first": "2023-01-21",
  "pack": null,
  "person": {
    "brief": "",
    "base": "rock",
    "traits": []
  }
}
