{
  "id": "endless-summer",
  "title": "Endless Summer",
  "artist": "Fennesz",
  "year": 2001,
  "spotify": "3Ombmwfn0Wi3twVHD0VyxS",
  "cover": "https://i.scdn.co/image/ab67616d0000b27350bb20bb2b20606ed918d652",
  "kingdom": "electronic",
  "logseq": {
    "page": "Endless Summer"
  },
  "added": "2026-10-03",
  "first": "2026-07-18",
  "pack": null,
  "person": {
    "brief": "",
    "base": "electronic",
    "traits": []
  }
}
