{
  "id": "ravedeath-1972",
  "title": "Ravedeath, 1972",
  "artist": "Tim Hecker",
  "year": 2011,
  "spotify": "6Iu8toVsvCc3I4INxYiVIy",
  "cover": "https://i.scdn.co/image/ab67616d0000b273dd3e6ebb68966851e511f350",
  "kingdom": "electronic",
  "logseq": {
    "page": "Ravedeath, 1972"
  },
  "added": "2026-10-03",
  "first": "2025-11-29",
  "pack": null,
  "person": {
    "brief": "",
    "base": "electronic",
    "traits": []
  }
}
