{
  "id": "lonerism",
  "title": "Lonerism",
  "artist": "Tame Impala",
  "year": 2012,
  "spotify": "3C2MFZ2iHotUQOSBzdSvM7",
  "cover": "https://i.scdn.co/image/ab67616d0000b273370c12f82872c9cfaee80193",
  "kingdom": "rock",
  "logseq": {
    "page": "Lonerism"
  },
  "added": "2026-10-03",
  "first": "2023-07-09",
  "pack": null,
  "person": {
    "brief": "",
    "base": "rock",
    "traits": []
  }
}
