{
  "id": "only-god-was-above-us",
  "title": "Only God Was Above Us",
  "artist": "Vampire Weekend",
  "year": 2024,
  "spotify": "1W04wu2W4OIcuiNc5AMB3y",
  "cover": "https://i.scdn.co/image/ab67616d0000b2734eb80469be3cfbbd3471081d",
  "kingdom": "indie",
  "logseq": {
    "page": "Only God Was Above Us"
  },
  "added": "2026-10-03",
  "first": "2024-10-11",
  "pack": null,
  "person": {
    "brief": "",
    "base": "indie",
    "traits": []
  }
}
